{"$schema":"https://json-schema.org/draft/2020-12/schema","title":"LeakageReport v1","type":"object","required":["passed","issues","counts","checked_entities","fold_plan_id","dataset_version_id","policy","validator_version","timestamp","schema_version","report_id","input_material_sha256","provenance"],"properties":{"passed":{"type":"boolean"},"issues":{"type":"array","items":{"$ref":"leakage-issue.schema.json"}},"counts":{"type":"object","required":["n_patients_checked","n_studies_checked","n_series_checked","n_slices_checked","n_file_hashes_checked","n_issues","n_errors","n_warnings","n_infos","issues_by_type"],"properties":{"n_patients_checked":{"type":"integer","minimum":0},"n_studies_checked":{"type":"integer","minimum":0},"n_series_checked":{"type":"integer","minimum":0},"n_slices_checked":{"type":"integer","minimum":0},"n_file_hashes_checked":{"type":"integer","minimum":0},"n_issues":{"type":"integer","minimum":0},"n_errors":{"type":"integer","minimum":0},"n_warnings":{"type":"integer","minimum":0},"n_infos":{"type":"integer","minimum":0},"issues_by_type":{"type":"object"}},"additionalProperties":true},"checked_entities":{"type":"object"},"fold_plan_id":{"type":["string","null"]},"dataset_version_id":{"type":["string","null"]},"policy":{"enum":["strict","audit"]},"validator_version":{"type":"string"},"timestamp":{"type":"string","format":"date-time"},"schema_version":{"const":1},"report_id":{"type":"string","pattern":"^[a-f0-9]{64}$"},"input_material_sha256":{"type":"string","pattern":"^[a-f0-9]{64}$"},"provenance":{"type":"object"}},"additionalProperties":false}
