{"checked_entities":{"n_file_hashes_checked":0,"n_patients_checked":2,"n_series_checked":2,"n_slices_checked":4,"n_studies_checked":2},"counts":{"issues_by_type":{},"n_errors":0,"n_file_hashes_checked":0,"n_infos":0,"n_issues":0,"n_patients_checked":2,"n_series_checked":2,"n_slices_checked":4,"n_studies_checked":2,"n_warnings":0},"dataset_version_id":"8dcccecb88a369d7cb2a9e442b46a85ceeddc52adda5c5521c94ed70d1a92c88","fold_plan_id":"bcbc964c3d5e767d97a974579c00d1fe3f01cf9e4dc7d3173261384cd6aa4e5b","input_material_sha256":"45715e0ffdd6714ab2ac92b54a3b6509a4d7d2e4404612de2d744c7a562158bb","issues":[],"passed":true,"policy":"strict","provenance":{"assignment_manifest_sha256":"9f8706106c97cf7d27fb37ab15452e9e6afc121026f407c3e591b825739ace72","assignment_source":"explicit","dataset_index_artifact_id":"08d84e2d98b8f2ec1a0ac5fbf77f3232ff7924e110c1030d475c28d125d0a77e","dataset_index_id":"a9bfaab9bb43901cc3d9d9c73b5003c54f727c445bb5b5e613b750d290143441","n_label_provenance_records":0,"n_parent_artifact_links":0,"n_source_entity_links":0},"report_id":"5a4a25fdb4be01cbee735f5a58bcb0611314d002341a6cb733e507a742077b32","schema_version":1,"timestamp":"2026-10-05T12:29:33.468706+00:00","validator_version":"1.0.0"}
